{
  "format": "openstratcore.scenario",
  "version": 1,
  "name": "高地攻坚",
  "map": "ridge_assault.map.json",
  "rules": "rules.default.json",
  "timeLimitSeconds": 1800,
  "sides": {
    "red": {
      "name": "红方突击群",
      "units": [
        {
          "id": "R_INF_1",
          "type": "infantry",
          "armor": "none",
          "teams": 3,
          "at": {
            "q": 0,
            "r": 2
          },
          "facing": 0,
          "state": "stopped"
        },
        {
          "id": "R_INF_2",
          "type": "infantry",
          "armor": "none",
          "teams": 3,
          "at": {
            "q": 0,
            "r": 3
          },
          "facing": 0,
          "state": "stopped"
        },
        {
          "id": "R_TANK_1",
          "type": "tank",
          "armor": "composite",
          "teams": 1,
          "at": {
            "q": 1,
            "r": 2
          },
          "facing": 0,
          "state": "stopped"
        },
        {
          "id": "R_ART_1",
          "type": "artillery",
          "armor": "medium",
          "teams": 1,
          "at": {
            "q": 0,
            "r": 1
          },
          "facing": 0,
          "state": "stopped"
        },
        {
          "id": "R_SWEEP_1",
          "type": "minesweeper",
          "armor": "medium",
          "teams": 1,
          "at": {
            "q": 1,
            "r": 3
          },
          "facing": 0,
          "state": "stopped"
        }
      ]
    },
    "blue": {
      "name": "蓝方高地守备队",
      "units": [
        {
          "id": "B_INF_1",
          "type": "infantry",
          "armor": "none",
          "teams": 3,
          "at": {
            "q": 6,
            "r": 2
          },
          "facing": 3,
          "state": "stopped"
        },
        {
          "id": "B_INF_2",
          "type": "infantry",
          "armor": "none",
          "teams": 3,
          "at": {
            "q": 5,
            "r": 2
          },
          "facing": 3,
          "state": "stopped"
        },
        {
          "id": "B_TANK_1",
          "type": "tank",
          "armor": "heavy",
          "teams": 1,
          "at": {
            "q": 7,
            "r": 3
          },
          "facing": 3,
          "state": "stopped"
        }
      ]
    }
  },
  "objectives": [
    {
      "id": "RIDGE_CP",
      "at": {
        "q": 6,
        "r": 2
      },
      "owner": "neutral",
      "priority": "primary"
    }
  ],
  "victory": {
    "mode": "capture_all"
  },
  "facilities": [
    {
      "kind": "works_infantry_combat",
      "at": {
        "q": 6,
        "r": 2
      },
      "owner": "blue",
      "armor": "heavy",
      "capacity": 3
    },
    {
      "kind": "minefield",
      "at": {
        "q": 4,
        "r": 2
      },
      "owner": "blue"
    },
    {
      "kind": "indirect_zone",
      "at": {
        "q": 6,
        "r": 2
      },
      "owner": "red"
    }
  ]
}
