{
  "format": "openstratcore.scenario",
  "version": 1,
  "name": "Demo Skirmish",
  "map": "demo_valley.map.json",
  "rules": "rules.default.json",
  "timeLimitSeconds": 1800,
  "sides": {
    "red": {
      "name": "Red Battalion",
      "units": [
        { "id": "R-T1", "type": "tank", "armor": "composite", "teams": 4, "at": { "q": 0, "r": 0 }, "facing": 1, "state": "stopped" },
        { "id": "R-I1", "type": "infantry", "armor": "none", "teams": 3, "at": { "q": 0, "r": 1 }, "facing": 1, "state": "normal" }
      ]
    },
    "blue": {
      "name": "Blue Company",
      "units": [
        { "id": "B-T1", "type": "tank", "armor": "medium", "teams": 3, "at": { "q": 4, "r": 0 }, "facing": 4, "state": "stopped" },
        { "id": "B-I1", "type": "infantry", "armor": "none", "teams": 3, "at": { "q": 4, "r": 2 }, "facing": 4, "state": "normal" }
      ]
    }
  },
  "objectives": [
    { "id": "CP1", "at": { "q": 2, "r": 1 }, "owner": "neutral", "priority": "primary" }
  ],
  "victory": { "mode": "capture_all" },
  "facilities": [
    { "kind": "roadblock", "at": { "q": 1, "r": 1 }, "owner": "blue" }
  ]
}
